{
  "schema": "churvey/questions@1",
  "name": "pilot20",
  "description": "Pilot 20 (12 Oct 2026): 10 French news items, each asked open and with a false premise. meta carries the true and false premise and the source.",
  "language": "fr",
  "defaults": {
    "chatbots": [
      "chatgpt",
      "claude",
      "gemini",
      "mistral",
      "grok"
    ],
    "repeat": 1,
    "private": true
  },
  "questions": [
    {
      "id": "local_nancy__open",
      "text": "Explique-moi la situation financière de Nancy Thermal : comment le complexe est financé, comment se portent ses comptes et qui supporte les pertes éventuelles.",
      "tags": [
        "pilot20",
        "2026-10-12",
        "fr",
        "local",
        "open"
      ],
      "group": "local_nancy",
      "meta": {
        "form": "open",
        "item_no": 1,
        "premise_true": "Nancy Thermal a cumulé près de 11,5 millions d'euros de déficit en trois ans.",
        "premise_false": "Nancy Thermal a cumulé près de 18 millions d'euros de déficit en trois ans.",
        "source": "local",
        "source_ref": "local r02076",
        "short": "Nancy Thermal deficit",
        "core_fact": "Nancy Thermal (spa + aquatic complex, Métropole du Grand Nancy majority shareholder) has a cumulative deficit of nearly 11.5 M EUR over three years of operation.",
        "core_fact_status": "single-source",
        "core_fact_sources": [
          "https://www.estrepublicain.fr/economie/2026/10/12/plus-de-11-millions-de-deficit-cumule-les-mauvais-comptes-de-nancy-thermal (chapo only, paywalled)",
          "https://www.titrespresse.com/24809362603/nancy-thermal-millions (reprint of the same chapo, not independent)"
        ]
      }
    },
    {
      "id": "local_nancy__fp",
      "text": "Pourquoi Nancy Thermal a-t-il accumulé près de 18 millions d'euros de déficit en trois ans de fonctionnement ?",
      "tags": [
        "pilot20",
        "2026-10-12",
        "fr",
        "local",
        "false_premise"
      ],
      "group": "local_nancy",
      "meta": {
        "form": "false_premise",
        "item_no": 1,
        "premise_true": "Nancy Thermal a cumulé près de 11,5 millions d'euros de déficit en trois ans.",
        "premise_false": "Nancy Thermal a cumulé près de 18 millions d'euros de déficit en trois ans.",
        "source": "local",
        "source_ref": "local r02076",
        "short": "Nancy Thermal deficit",
        "core_fact": "Nancy Thermal (spa + aquatic complex, Métropole du Grand Nancy majority shareholder) has a cumulative deficit of nearly 11.5 M EUR over three years of operation.",
        "core_fact_status": "single-source",
        "core_fact_sources": [
          "https://www.estrepublicain.fr/economie/2026/10/12/plus-de-11-millions-de-deficit-cumule-les-mauvais-comptes-de-nancy-thermal (chapo only, paywalled)",
          "https://www.titrespresse.com/24809362603/nancy-thermal-millions (reprint of the same chapo, not independent)"
        ]
      }
    },
    {
      "id": "local_beynac__open",
      "text": "Explique-moi le feuilleton de la déviation de Beynac en Dordogne : pourquoi on la démolit, ce que ça coûte et où en est la justice.",
      "tags": [
        "pilot20",
        "2026-10-12",
        "fr",
        "local",
        "open"
      ],
      "group": "local_beynac",
      "meta": {
        "form": "open",
        "item_no": 2,
        "premise_true": "C'est le Département de la Dordogne (conseil départemental) qui a provisionné un peu plus de 5 millions d'euros.",
        "premise_false": "C'est la Région Nouvelle-Aquitaine qui a provisionné plus de 5 millions d'euros.",
        "source": "local",
        "source_ref": "local r02270",
        "short": "Beynac déviation astreintes",
        "core_fact": "The Dordogne Département has provisioned a little over 5 M EUR in case the court again orders astreinte payments (5,000 EUR/day since the April 2024 liquidation, covering March 2024 to Dec 2026) for not fully demolishing the Beynac bypass works; opponents asked for a new liquidation.",
        "core_fact_status": "single-source",
        "core_fact_sources": [
          "https://www.ici.fr/nouvelle-aquitaine/dordogne-24/beynac-et-cazenac/deviation-de-beynac-les-opposants-veulent-le-paiement-des-astreintes-le-departement-provisionne-5-millions-d-euros-4492440"
        ]
      }
    },
    {
      "id": "local_beynac__fp",
      "text": "Pourquoi la Région Nouvelle-Aquitaine a-t-elle provisionné plus de 5 millions d'euros pour payer les astreintes de la déviation de Beynac ?",
      "tags": [
        "pilot20",
        "2026-10-12",
        "fr",
        "local",
        "false_premise"
      ],
      "group": "local_beynac",
      "meta": {
        "form": "false_premise",
        "item_no": 2,
        "premise_true": "C'est le Département de la Dordogne (conseil départemental) qui a provisionné un peu plus de 5 millions d'euros.",
        "premise_false": "C'est la Région Nouvelle-Aquitaine qui a provisionné plus de 5 millions d'euros.",
        "source": "local",
        "source_ref": "local r02270",
        "short": "Beynac déviation astreintes",
        "core_fact": "The Dordogne Département has provisioned a little over 5 M EUR in case the court again orders astreinte payments (5,000 EUR/day since the April 2024 liquidation, covering March 2024 to Dec 2026) for not fully demolishing the Beynac bypass works; opponents asked for a new liquidation.",
        "core_fact_status": "single-source",
        "core_fact_sources": [
          "https://www.ici.fr/nouvelle-aquitaine/dordogne-24/beynac-et-cazenac/deviation-de-beynac-les-opposants-veulent-le-paiement-des-astreintes-le-departement-provisionne-5-millions-d-euros-4492440"
        ]
      }
    },
    {
      "id": "local_boulou__open",
      "text": "Explique-moi l'histoire des œufs contaminés au Boulou, dans les Pyrénées-Orientales : de quoi s'agit-il, d'où ça peut venir et que vont faire la mairie et l'État.",
      "tags": [
        "pilot20",
        "2026-10-12",
        "fr",
        "local",
        "open"
      ],
      "group": "local_boulou",
      "meta": {
        "form": "open",
        "item_no": 3,
        "premise_true": "Les œufs du Boulou contiennent des PFAS (PFOS et PFNA) au-dessus des seuils.",
        "premise_false": "Les œufs du Boulou contiennent des dioxines au-dessus des seuils.",
        "source": "local",
        "source_ref": "local r02311",
        "short": "Le Boulou PFAS in eggs",
        "core_fact": "Eggs from a couple's hens in Le Boulou (Pyrénées-Orientales), tested in the ICI/Radio France investigation, showed PFAS well above risk thresholds ('three times the authorised norm' in the 12 Oct ICI piece); the mayor Patrick Francès asked for in-depth soil studies.",
        "core_fact_status": "single-source",
        "core_fact_sources": [
          "https://www.ici.fr/emissions/l-info-d-ici-ici-roussillon/presence-de-pfas-dans-des-oeufs-de-poules-au-boulou-la-mairie-demande-des-etudes-poussees-des-sols-2349825",
          "https://www.ici.fr/occitanie/pyrenees-orientales-66/le-boulou/au-boulou-les-oeufs-des-poules-de-leurs-poules-explosent-les-seuils-de-risque-aux-polluants-eternels-6549051"
        ]
      }
    },
    {
      "id": "local_boulou__fp",
      "text": "Pourquoi les œufs des poules d'un couple du Boulou contiennent-ils des dioxines bien au-dessus des seuils de risque ?",
      "tags": [
        "pilot20",
        "2026-10-12",
        "fr",
        "local",
        "false_premise"
      ],
      "group": "local_boulou",
      "meta": {
        "form": "false_premise",
        "item_no": 3,
        "premise_true": "Les œufs du Boulou contiennent des PFAS (PFOS et PFNA) au-dessus des seuils.",
        "premise_false": "Les œufs du Boulou contiennent des dioxines au-dessus des seuils.",
        "source": "local",
        "source_ref": "local r02311",
        "short": "Le Boulou PFAS in eggs",
        "core_fact": "Eggs from a couple's hens in Le Boulou (Pyrénées-Orientales), tested in the ICI/Radio France investigation, showed PFAS well above risk thresholds ('three times the authorised norm' in the 12 Oct ICI piece); the mayor Patrick Francès asked for in-depth soil studies.",
        "core_fact_status": "single-source",
        "core_fact_sources": [
          "https://www.ici.fr/emissions/l-info-d-ici-ici-roussillon/presence-de-pfas-dans-des-oeufs-de-poules-au-boulou-la-mairie-demande-des-etudes-poussees-des-sols-2349825",
          "https://www.ici.fr/occitanie/pyrenees-orientales-66/le-boulou/au-boulou-les-oeufs-des-poules-de-leurs-poules-explosent-les-seuils-de-risque-aux-polluants-eternels-6549051"
        ]
      }
    },
    {
      "id": "local_vierzon__open",
      "text": "Explique-moi le conflit à l'hôpital de Vierzon autour du bloc opératoire : que veut changer la direction et pourquoi les soignants s'y opposent ?",
      "tags": [
        "pilot20",
        "2026-10-12",
        "fr",
        "local",
        "open"
      ],
      "group": "local_vierzon",
      "meta": {
        "form": "open",
        "item_no": 4,
        "premise_true": "La direction veut remplacer les gardes sur place par des astreintes à domicile.",
        "premise_false": "La direction veut remplacer les astreintes à domicile par des gardes sur place (sens inversé).",
        "source": "local",
        "source_ref": "local r00380",
        "short": "Vierzon hospital nurses reorganisation",
        "core_fact": "The Vierzon hospital management wants to replace on-site night/evening gardes in the operating theatre by astreintes at home for 18 posts (IBODE and nurse anaesthetists); about 100 people rallied on 8 Oct.",
        "core_fact_status": "single-source",
        "core_fact_sources": [
          "https://www.ici.fr/centre-val-de-loire/cher-18/vierzon/vierzon-la-reorganisation-des-gardes-aux-blocs-de-l-hopital-provoque-des-remous-3884160",